{
  "schema_version": "0.1",
  "proof_id": "m2-033",
  "target": {
    "proof_id": "m2-033",
    "node_id": 2,
    "version": 1
  },
  "target_node": {
    "proof_id": "m2-033",
    "node_id": 2,
    "version": 1,
    "order_key": 20,
    "claim": "等式两边约去因子 x-1，得到 x+1=0。",
    "self_contained_claim": "等式两边约去因子 x-1，得到 x+1=0。",
    "node_type": "calculation_step",
    "depends_on": [
      {
        "proof_id": "m2-033",
        "node_id": 1,
        "version": 1
      }
    ]
  },
  "error_certificate": {
    "certificate_id": "m2-033-batch-v0.2-error-r1",
    "target": {
      "proof_id": "m2-033",
      "node_id": 2,
      "version": 1
    },
    "failed_inference": "The current topological node failed independent revalidation.",
    "repair_constraints": {
      "allowed_operations": [
        "delete",
        "replace"
      ],
      "max_new_nodes": 2,
      "preserve_theorem": true,
      "preserve_assumptions": true
    }
  },
  "allowed_operations": [
    "delete",
    "mark_irreparable",
    "replace"
  ],
  "budget": {
    "max_rounds": 4,
    "max_new_nodes": 2,
    "max_total_edits": 4
  },
  "m4_accepted_certificates": [],
  "m4_input_digest": "sha256:4f53cda18c2baa0c0354bb5f9a3ecbe5ed12ab4d8e11ba873c2f11161202b945"
}
