{
  "schema_version": "0.1",
  "proof_id": "m2-012",
  "target": {"proof_id": "m2-012", "node_id": 2, "version": 1},
  "target_node": {
    "proof_id": "m2-012",
    "node_id": 2,
    "version": 1,
    "order_key": 20,
    "claim": "因此 a|c。",
    "self_contained_claim": "因此 a|c。",
    "node_type": "conclusion",
    "depends_on": [{"proof_id": "m2-012", "node_id": 1, "version": 1}]
  },
  "error_certificate": {
    "certificate_id": "m2-012-m3-gap-node-2-v1",
    "target": {"proof_id": "m2-012", "node_id": 2, "version": 1},
    "failed_inference": "The proof omits substitution of b=am into c=bn and the integer-witness step required by the definition of divisibility.",
    "repair_constraints": {
      "allowed_operations": ["insert_before", "replace"],
      "max_new_nodes": 2,
      "preserve_theorem": true,
      "preserve_assumptions": true
    }
  },
  "allowed_operations": ["insert_before", "mark_irreparable", "replace"],
  "budget": {"max_rounds": 3, "max_new_nodes": 2, "max_total_edits": 4},
  "m4_accepted_certificates": [],
  "m4_input_digest": "sha256:4f53cda18c2baa0c0354bb5f9a3ecbe5ed12ab4d8e11ba873c2f11161202b945"
}

